URL,Title,Meta Description,H1,Title Length,Meta Description Length,H1 Length,Title = H1?
https://www.pearltalent.com/resources/executive-assistant-to-ceo-job-description,Comprehensive 2024 CEO Executive Assistant Job Description Template,Providing a clear CEO executive assistant job description is essential to hiring a candidate who can give the CEO the most effective support. A well-crafted job description helps organizations attract qualified candidates who can contribute to the CEO's strategic goals and overall efficiency.,Comprehensive 2024 CEO Executive Assistant Job Description Template,67,293,67,Yes
https://www.pearltalent.com/resources/executive-assistant-job-description,"Executive Assistant Responsibilities: Skills, Duties, and a Free Template","In today's fast-paced business world, organizations rely on skilled professionals to ensure smooth operations and effective management. Executive assistants support high-level executives and manage their busy schedules, making executive assistant responsibilities essential to overall efficiency.","Executive Assistant Responsibilities: Skills, Duties, and a Free Template",73,296,73,Yes
https://www.pearltalent.com/resources/honest-review-of-taskus-a-2024-ultimate-guide,Honest Review of TaskUs: A 2024 Ultimate Guide,"Discover an in-depth review of TaskUs, a leading outsourcing company, and learn about its services, strengths, and areas for improvement. Get insights into customer experiences and recommendations for businesses considering outsourcing.",Honest Review of TaskUs: A 2024 Ultimate Guide,46,236,46,Yes
https://www.pearltalent.com/resources/healthcare-virtual-assistant-hiring-platforms-7-sites,Healthcare Virtual Assistant Hiring Platforms: 7+ Sites,"The healthcare industry witnesses an escalating demand for efficient solutions, fostering a growing need for virtual healthcare assistants. These digital aides are pivotal in streamlining medical records, patient data, and administrative tasks, constituting a significant pillar within the healthcare sector.",Healthcare Virtual Assistant Hiring Platforms: 7+ Sites,55,308,55,Yes
https://www.pearltalent.com/resources/administrative-assistant-skills,7+ Administrative Assistant Skills to Know Before Hiring,"Explore the essential administrative assistant skills needed for hiring top-tier candidates. Learn about organizational skills, communication, and more to streamline your hiring process.",7+ Administrative Assistant Skills to Know Before Hiring,56,186,56,Yes
https://www.pearltalent.com/resources/hire-executive-assistant,16+ Best Sites to Hire Executive Assistants for Startups,Discover the best platforms to hire executive assistants for startups. Explore top sites that connect you with skilled professionals to support your business needs.,16+ Best Sites to Hire Executive Assistants for Startups,56,164,56,Yes
https://www.pearltalent.com/resources/types-of-outsourcing,9 Types Of Outsourcing: Pros & Cons | Identify The Best Fit,Outsourcing is catching on like wildfire in today's business world. But you know what the real kicker is in all of this? Knowing the different types of outsourcing to see which will work best for you.,9 Types Of Outsourcing: Pros & Cons | Identify The Best Fit,59,200,59,Yes
https://www.pearltalent.com/resources/virtual-assistant-cost,Virtual Assistant Cost: Calculating Ideal Hourly Costs 2024,Discover the ideal hourly costs for hiring a virtual assistant in 2024. Learn about the factors affecting costs and how to calculate your total expenses effectively.,Virtual Assistant Cost: Calculating Ideal Hourly Costs 2024,59,165,59,Yes
https://www.pearltalent.com/resources/best-calendar-management-tools,7+ Best Calendar Management Tools For Busy Executives,Effective calendar management is crucial for maximizing productivity and staying organized in today's fast-paced world. Choosing the best calendar management tools can be overwhelming with the many options available. Here's a step-by-step guide to help you make the right choice:,7+ Best Calendar Management Tools For Busy Executives,53,279,53,Yes
https://www.pearltalent.com/resources/personal-assistant-job-description,Personal Assistant Job Description: Role and Responsibilities,"Creating a personal assistant job description involves highlighting the role of supporting executives and managers in prioritizing task efficiency and managing daily operations. Personal assistants handle a variety of business tasks, allowing executives or top managers to concentrate on strategic decision-making.",Personal Assistant Job Description: Role and Responsibilities,61,314,61,Yes
https://www.pearltalent.com/resources/remote-sales-representative,What Are the Advantages of Having a Remote Sales Representative?,"The rise of remote work has transformed how businesses operate. This shift has brought new opportunities for efficiency and flexibility. In the sales industry, remote sales representatives lead this change, offering a fresh approach to reaching customers.",What Are the Advantages of Having a Remote Sales Representative?,64,255,64,Yes
